{
  "version": 1,
  "note": "The one record every colour, space and duration on the site comes from. tools/tokens.mjs renders it to site/src/styles/tokens.css and computes every contrast ratio, tools/check_tokens.mjs fails CI when the rendered file is stale, when a text pair falls under 4.5 to 1, or when a component writes a hex, a millisecond or a curve by hand. Nothing here is typed twice.",
  "colour": {
    "light": {
      "paper": "#f1f2ef",
      "ink": "#141619",
      "muted": "#62676d",
      "rule": "#d3d6d3",
      "field": "#e6e8e5",
      "marker": "#b92d22",
      "blueprint": "#35648a"
    },
    "dark": {
      "paper": "#0f1113",
      "ink": "#e6e8e4",
      "muted": "#9aa0a6",
      "rule": "#262a2e",
      "field": "#171a1d",
      "marker": "#ff6157",
      "blueprint": "#7aa7cc"
    },
    "plate": {
      "plate": "#0b0c0d",
      "plate-ink": "#e6e8e4",
      "plate-muted": "#9aa0a6",
      "plate-marker": "#ff6157",
      "plate-rule": "#1a1d20"
    },
    "roles": {
      "paper": "page ground",
      "ink": "text, the H1, rules on plates",
      "muted": "secondary text, captions, nav at rest, spec rail labels",
      "rule": "1px hairlines only, never text, about 1.3 to 1 on paper",
      "field": "code blocks, the spec sheet, the filmstrip track, a tone rather than a card",
      "marker": "the one accent: frame numbers, the active chapter, hover, focus, the record dot",
      "blueprint": "build chapters only: graph strokes, histogram bars, code links",
      "plate": "every media band in both themes, so the work reads at cinema contrast whatever the page does"
    },
    "pairs": [
      {
        "fg": "ink",
        "bg": "paper",
        "text": true
      },
      {
        "fg": "muted",
        "bg": "paper",
        "text": true
      },
      {
        "fg": "marker",
        "bg": "paper",
        "text": true
      },
      {
        "fg": "blueprint",
        "bg": "paper",
        "text": true
      },
      {
        "fg": "muted",
        "bg": "field",
        "text": true
      },
      {
        "fg": "ink",
        "bg": "field",
        "text": true
      },
      {
        "fg": "rule",
        "bg": "paper",
        "text": false
      },
      {
        "fg": "plate-ink",
        "bg": "plate",
        "text": true
      },
      {
        "fg": "plate-muted",
        "bg": "plate",
        "text": true
      },
      {
        "fg": "plate-marker",
        "bg": "plate",
        "text": true
      }
    ]
  },
  "grid": {
    "content-max": "72rem",
    "gutter": "clamp(1rem, 4vw, 3rem)",
    "grid-gap": "1.5rem",
    "measure": "66ch"
  },
  "motion": {
    "note": "The work is the motion and the interface stays still. Two columns: the value, and what it becomes under reduced motion, which is a decision per movement rather than a switch that zeroes everything. A colour change and an opacity fade are not movement.",
    "tokens": [
      {
        "name": "t-quick",
        "default": "120ms",
        "reduced": "120ms",
        "used_by": "row hover tint, hover intent timer",
        "why": "A colour change is not movement."
      },
      {
        "name": "t-fade",
        "default": "380ms",
        "reduced": "380ms",
        "used_by": "preview in, plate crossfade",
        "why": "Opacity is not movement, and a hard cut between stills is worse for vestibular readers than a short fade."
      },
      {
        "name": "t-slide",
        "default": "230ms",
        "reduced": "0ms",
        "used_by": "the chapter rail mark",
        "why": "Position change becomes a cut, same end state."
      },
      {
        "name": "t-blink",
        "default": "500ms",
        "reduced": "0ms",
        "used_by": "the record dot while a clip plays",
        "why": "Becomes a steady dot, and a mono PLAYING label sits beside it so the blink is never the only signal."
      },
      {
        "name": "ease-out",
        "default": "cubic-bezier(0.2, 0, 0, 1)",
        "reduced": "linear",
        "used_by": "anything entering or moving",
        "why": "Nothing moves under reduce, so the curve is moot and linear says so."
      },
      {
        "name": "ease-in",
        "default": "cubic-bezier(0.4, 0, 1, 1)",
        "reduced": "linear",
        "used_by": "anything leaving",
        "why": "As above."
      },
      {
        "name": "slip-x",
        "default": "0.34em",
        "reduced": "0.34em",
        "used_by": "how far a misregistered word slips",
        "why": "A distance, not a duration. The travel is cut under reduce by --t-slide going to zero, so the offset itself does not change and the fringe still prints."
      },
      {
        "name": "rise-y",
        "default": "0.5rem",
        "reduced": "0.5rem",
        "used_by": "how far the hero rises on first paint",
        "why": "Same reason. --t-fade carries the same value in both columns because a fade is not the movement reduce protects against, so this distance holds too."
      },
      {
        "name": "press",
        "default": "0.985",
        "reduced": "1",
        "used_by": "the scale a tile takes while pressed",
        "why": "Unitless, fed to scale(). It flattens to 1 under reduce, because a press that moves is the one part of this that is movement rather than feedback."
      },
      {
        "name": "slip-band",
        "default": "13rem",
        "reduced": "13rem",
        "used_by": "how far from the cursor a word still lifts",
        "why": "A radius, not a duration. The fringe fades out with distance from the pointer so a title answers where the eye is rather than all at once, and the words themselves never move apart."
      }
    ],
    "scroll": {
      "default": "smooth",
      "reduced": "auto"
    }
  },
  "rules": [
    {
      "rule": "Rule is a hairline and never text. It measures about 1.3 to 1 on paper, so an absent chapter is muted with a line through it, never set in rule.",
      "enforcement": "tools/check_tokens.mjs"
    },
    {
      "rule": "The interface stays still and the work is the motion. Every movement has a name here and a reduced value that's a choice rather than a zero.",
      "enforcement": "tools/check_tokens.mjs"
    },
    {
      "rule": "Plate is dark in both themes and carries its own ink, muted and marker, because the light marker on it measures 3.2 to 1 and fails.",
      "enforcement": "data/design/tokens.json"
    },
    {
      "rule": "Nothing shifts. Every image and video declares its box before its bytes arrive, and the build fails on any layout shift at all.",
      "enforcement": "site/lighthouserc.json"
    },
    {
      "rule": "Nothing is defined for the first time inside a media query or a data attribute block. Light is the base and the dark blocks only redefine.",
      "enforcement": "tools/tokens.mjs"
    },
    {
      "rule": "A component never writes a literal. It names a token, and a hex, a millisecond or a curve written by hand fails the build.",
      "enforcement": "tools/check_tokens.mjs"
    },
    {
      "rule": "One inline script runs before paint, for the visitor's own preferences, and every page is complete without it.",
      "enforcement": "docs/decisions/0013-preferences-before-paint.md"
    }
  ]
}
